{
  "id": "mk-deception-noob-smoke-ending",
  "type": "source",
  "name": "Mortal Kombat: Deception — Noob-Smoke Ending",
  "sourceType": "game_ending",
  "game": "Mortal Kombat: Deception",
  "year": 2004,
  "notes": "Retrospective ending text identifying Noob Saibot as the original Sub-Zero and stating that he died at Scorpion's hand before descending to the Netherrealm."
}
