{
  "id": "mk1-story",
  "type": "source",
  "name": "Mortal Kombat 1 Story Mode",
  "sourceType": "game_story",
  "game": "Mortal Kombat 1",
  "year": 2023,
  "url": "https://game-scripts-wiki.blogspot.com/2023/11/mortal-kombat-1-full-transcript.html",
  "notes": "Primary in-game New Era story material accessed through a transcript mirror. The story repeatedly identifies Sindel as Empress of Outworld, names Jerrod as her late husband, and later reunites them when Jerrod's soul controls Ermac. The mirror is access infrastructure, not canonical authority."
}
