{
  "id": "mk2-liu-kang-bio",
  "type": "source",
  "name": "Mortal Kombat II — Liu Kang Biography",
  "sourceType": "game_bio",
  "game": "Mortal Kombat II",
  "year": 1993,
  "url": "https://www.trmk.org/games/mortal_kombat_2/moves/127/Liu_Kang/",
  "notes": "Primary in-game biography reproduced by TRMK. It states that Liu Kang won the Shaolin Tournament from Shang Tsung's control and returned to find many Shaolin brothers slain by Outworld warriors."
}
