{
  "id": "mk30-scorpion-profile",
  "type": "source",
  "name": "Mortal Kombat 30th Anniversary — Scorpion Profile",
  "sourceType": "official_web",
  "year": 2022,
  "url": "https://mk30.mortalkombat.com/en-us/roster/scorpion",
  "notes": "Official anniversary profile describing Hanzo Hasashi, his vengeance for his family and clan, and Quan Chi as their murderer in the Earthrealm continuity."
}
