{
  "id": "mk11-first-look-official",
  "type": "source",
  "name": "First Look at Mortal Kombat 11",
  "sourceType": "official_web",
  "game": "Mortal Kombat 11",
  "year": 2019,
  "url": "https://warnerbrosgames.com/article/first-look-at-mortal-kombat-11",
  "notes": "Official Warner Bros. Games reveal material describing Kronika as Keeper of Time and creator of existence. The creator-of-existence wording is preserved as supplemental promotional evidence rather than used to overwrite or synthesize another continuity's cosmology."
}
