{
  "id": "mkda-quan-chi-bio",
  "type": "source",
  "name": "Mortal Kombat: Deadly Alliance — Quan Chi Biography",
  "sourceType": "game_bio",
  "game": "Mortal Kombat: Deadly Alliance",
  "year": 2002,
  "url": "https://www.mortalkombatwarehouse.com/mkda/bios/",
  "notes": "Official in-game Quan Chi biography reproduced by Mortal Kombat Warehouse, used here as preservation/access infrastructure rather than canonical authority. The biography states that Quan Chi had stolen the amulet from the fallen Elder God Shinnok before later discovering more of the amulet's capabilities. This directly supports the narrow theft claim in Original continuity. It does not date the theft precisely relative to Shinnok's later-confirmed defeat, establish that the defeat caused or enabled the theft, or by itself prove a specific post-defeat state for Shinnok."
}
