{
  "id": "mk11-scorpion-bio",
  "type": "source",
  "name": "Mortal Kombat 11 — Scorpion Biography",
  "sourceType": "game_bio",
  "game": "Mortal Kombat 11",
  "year": 2019,
  "notes": "Biography describing Hanzo Hasashi's vengeance and Quan Chi's responsibility for the murder of his family and clan."
}
