{
  "id": "mk1-khaos-reigns-wb-announcement",
  "type": "source",
  "name": "WB Games — Mortal Kombat 1: Khaos Reigns Announcement",
  "sourceType": "official_web",
  "year": 2024,
  "url": "https://warnerbrosgames.com/index.php/article/mortal-kombat-1-khaos-reigns",
  "notes": "Official WB Games announcement stating that Bi-Han was Sub-Zero and that Titan Havik stole his soul to create Noob Saibot."
}
