{
  "id": "mk-deception-shujinko-bio",
  "type": "source",
  "name": "Mortal Kombat: Deception — Shujinko Biography",
  "sourceType": "game_bio",
  "game": "Mortal Kombat: Deception",
  "year": 2004,
  "url": "https://www.trmk.org/games/mortal_kombat_deception/moves/193/Shujinko/",
  "notes": "In-game biography reproduced by TRMK. Shujinko states that the Elder Gods used the Kamidogu to smash the One Being, forming the realms, and warns that recombining them could merge the realms and reawaken the One Being."
}
