{
  "id": "mk-deception-nightwolf-ending",
  "type": "source",
  "name": "Mortal Kombat: Deception — Nightwolf Ending",
  "sourceType": "game_ending",
  "game": "Mortal Kombat: Deception",
  "year": 2004,
  "url": "https://www.mortalkombatwarehouse.com/mkd/nightwolf/",
  "notes": "In-game ending accessed through the MKWarehouse preservation mirror. It portrays Nightwolf drawing a binding symbol in the Netherrealm and binding Onaga's spirit there. Later Armageddon biographies confirm the broad imprisonment and binding outcome; the ending's additional ritual detail remains ending-level evidence."
}
