{
  "id": "mk-deception-liu-kang-bio",
  "type": "source",
  "name": "Mortal Kombat: Deception — Liu Kang Biography",
  "sourceType": "game_bio",
  "game": "Mortal Kombat: Deception",
  "year": 2004,
  "url": "https://www.mortalkombatwarehouse.com/mkd/liukang/",
  "notes": "Official in-game Liu Kang biography reproduced by Mortal Kombat Warehouse, used here as preservation/access infrastructure rather than canonical authority. Liu Kang retrospectively states that Shang Tsung killed him and consumed his soul. This later Original-continuity primary source independently corroborates the Liu Kang death and soul-consumption outcomes presented in Mortal Kombat: Deadly Alliance."
}
