{
  "id": "mkda-kitana-bio",
  "type": "source",
  "name": "Mortal Kombat: Deadly Alliance — Kitana Biography",
  "sourceType": "game_bio",
  "game": "Mortal Kombat: Deadly Alliance",
  "year": 2002,
  "url": "https://www.trmk.org/games/mortal_kombat_deadly_alliance/moves/214/Kitana/",
  "notes": "Primary in-game biography reproduced by TRMK. It states that Kitana had freed Edenia from Shao Kahn's grasp before leading Edenian forces against the weakened emperor."
}
