{
  "id": "mk-armageddon-nightwolf-bio",
  "type": "source",
  "name": "Mortal Kombat: Armageddon — Nightwolf Biography",
  "sourceType": "game_bio",
  "game": "Mortal Kombat: Armageddon",
  "year": 2006,
  "url": "https://www.mortalkombatwarehouse.com/mka/nightwolf/",
  "notes": "Official in-game biography accessed through the MKWarehouse preservation mirror. Nightwolf states that he imprisoned Onaga's corrupt soul and was then released from the Netherrealm."
}
