{
  "id": "mk11-official-launch",
  "type": "source",
  "name": "Official Mortal Kombat 11 Launch Announcement",
  "sourceType": "official_web",
  "game": "Mortal Kombat 11",
  "year": 2019,
  "url": "https://warnerbrosgames.com/article/official-mortal-kombat-11-launch-announcement",
  "notes": "Official Warner Bros. Games launch material. It identifies Kronika as Keeper of Time and frames her objective as rewinding time to its beginning and restarting history to restore her desired balance."
}
