{
  "id": "mk-gold-kitana-bio",
  "type": "source",
  "name": "Mortal Kombat Gold — Kitana Biography",
  "sourceType": "game_bio",
  "game": "Mortal Kombat Gold",
  "year": 1999,
  "url": "https://www.mortalkombatwarehouse.com/mkg/bios/",
  "notes": "Official Mortal Kombat Gold Kitana biography reproduced by Mortal Kombat Warehouse, used here as preservation/access infrastructure rather than canonical authority. The biography states that Quan Chi's forces leave Edenia to battle Raiden and his forces, and that Kitana then moves into the battle against Shinnok and Quan Chi. This directly supports Quan Chi as an active opponent in the Original-continuity MK4/Gold conflict. It does not establish that Quan Chi caused Shinnok's escape, identify the battle's destination realm, or prove a direct causal edge from this battle to Shinnok's later-confirmed defeat."
}
