{
  "id": "mk4-liu-kang-ending",
  "type": "source",
  "name": "Mortal Kombat 4 — Liu Kang Ending",
  "sourceType": "game_ending",
  "game": "Mortal Kombat 4",
  "year": 1997,
  "url": "https://www.mortalkombatwarehouse.com/mk4/liukang/",
  "notes": "Primary Liu Kang ending material preserved by Mortal Kombat Warehouse, used as preservation/access infrastructure rather than canonical authority. The ending frames Liu Kang as having defended Earthrealm and Kitana credits Shinnok's destruction with saving both Earthrealm and Edenia. This supports an ending-specific individual-victor reading, but later Original-continuity biography evidence used by this project confirms only that Shinnok had been defeated years earlier and does not identify Liu Kang as the individual victor, so no canon named-victor Fact is promoted from this ending alone."
}
