{
  "id": "mk9-scorpion-bio",
  "type": "source",
  "name": "Mortal Kombat (2011) — Scorpion Biography",
  "sourceType": "game_bio",
  "game": "Mortal Kombat",
  "year": 2011,
  "notes": "Scorpion biography for the reboot continuity, describing Hanzo Hasashi's death, Quan Chi's role, and Scorpion's return."
}
