{
  "id": "mkt-shao-kahn-bio",
  "type": "source",
  "name": "Mortal Kombat Trilogy — Shao Kahn Biography",
  "sourceType": "game_bio",
  "game": "Mortal Kombat Trilogy",
  "year": 1996,
  "url": "https://gamefaqs.gamespot.com/ps/197997-mortal-kombat-trilogy/faqs/2153",
  "notes": "Primary in-game biography preserved in a GameFAQs guide. It states that Shao Kahn rose to power in Outworld, usurped the realm from Kitana's parents, and took Queen Sindel as his bride."
}
