{
  "id": "mkda-story",
  "type": "source",
  "name": "Mortal Kombat: Deadly Alliance — Game Story",
  "sourceType": "game_story",
  "game": "Mortal Kombat: Deadly Alliance",
  "year": 2002,
  "url": "https://www.mortalkombatwarehouse.com/mkda/",
  "notes": "Primary Mortal Kombat: Deadly Alliance story/intro text preserved by Mortal Kombat Warehouse, used as preservation/access infrastructure rather than canonical authority. Raiden's narration states that Quan Chi formed an alliance with Shang Tsung, that together they plotted to overpower the principal obstacles to their domination, and that the first obstacle presented is Shao Kahn, against whom they spring a false-allegiance attack. The story then has the sorcerers travel to Earthrealm, where Shang Tsung, with Quan Chi's assistance, consumes Liu Kang's soul and Liu Kang dies. This source directly supports the alliance, elimination plan, first attack occurrence, Earthrealm confrontation, Liu Kang death, and soul-consumption claims. It does not explicitly state that Shao Kahn dies, and later Deception primary evidence establishes a clone-decoy escape history, so the first attack is not modeled as a confirmed Shao Kahn death."
}
