{
  "id": "mk1-liu-kang-ending",
  "type": "source",
  "name": "Mortal Kombat (1992) — Liu Kang Ending",
  "sourceType": "game_ending",
  "game": "Mortal Kombat",
  "year": 1992,
  "url": "https://www.mortalkombatwarehouse.com/mk1/liukang/bio/",
  "notes": "Primary arcade ending text preserved by Mortal Kombat Warehouse. It states that Liu Kang defeated Goro, ended Shang Tsung's rule over the tournament, and returned the contest to the Shaolin Temples. This slice does not treat the ending as sufficient by itself; later Original-continuity story/biography evidence is used to confirm the outcome."
}
